{
  "schema_version": "1.0",
  "language": "fr-FR",
  "note_ko": "한국어 발음 표기는 여행용 근사치이며 실제 프랑스어 음가를 완전히 재현하지 않는다.",
  "count": 120,
  "phrases": [
    {
      "id": "fr_essential_001",
      "category": "essential",
      "priority": "P0",
      "fr": "Bonjour.",
      "ko": "안녕하세요.",
      "pronunciation_hint": "봉주르",
      "usage_note": "가게·식당·호텔에 들어갈 때 먼저 인사한다.",
      "tags": [
        "essential"
      ],
      "audio_text": "Bonjour."
    },
    {
      "id": "fr_essential_002",
      "category": "essential",
      "priority": "P0",
      "fr": "Bonsoir.",
      "ko": "안녕하세요 / 좋은 저녁입니다.",
      "pronunciation_hint": "봉수아르",
      "usage_note": "저녁 시간대 인사.",
      "tags": [
        "essential"
      ],
      "audio_text": "Bonsoir."
    },
    {
      "id": "fr_essential_003",
      "category": "essential",
      "priority": "P0",
      "fr": "Merci.",
      "ko": "감사합니다.",
      "pronunciation_hint": "메르시",
      "usage_note": "가장 기본적인 감사 표현.",
      "tags": [
        "essential"
      ],
      "audio_text": "Merci."
    },
    {
      "id": "fr_essential_004",
      "category": "essential",
      "priority": "P0",
      "fr": "Merci beaucoup.",
      "ko": "대단히 감사합니다.",
      "pronunciation_hint": "메르시 보쿠",
      "usage_note": "조금 더 정중한 감사.",
      "tags": [
        "essential"
      ],
      "audio_text": "Merci beaucoup."
    },
    {
      "id": "fr_essential_005",
      "category": "essential",
      "priority": "P0",
      "fr": "S'il vous plaît.",
      "ko": "부탁합니다 / 주세요.",
      "pronunciation_hint": "실 부 플레",
      "usage_note": "요청문 뒤에 붙이면 정중해진다.",
      "tags": [
        "essential"
      ],
      "audio_text": "S'il vous plaît."
    },
    {
      "id": "fr_essential_006",
      "category": "essential",
      "priority": "P0",
      "fr": "Excusez-moi.",
      "ko": "실례합니다.",
      "pronunciation_hint": "엑스퀴제 무아",
      "usage_note": "말을 걸거나 길을 물을 때.",
      "tags": [
        "essential"
      ],
      "audio_text": "Excusez-moi."
    },
    {
      "id": "fr_essential_007",
      "category": "essential",
      "priority": "P0",
      "fr": "Pardon.",
      "ko": "죄송합니다 / 지나갈게요.",
      "pronunciation_hint": "파르동",
      "usage_note": "가볍게 부딪히거나 지나갈 때.",
      "tags": [
        "essential"
      ],
      "audio_text": "Pardon."
    },
    {
      "id": "fr_essential_008",
      "category": "essential",
      "priority": "P0",
      "fr": "Oui.",
      "ko": "네.",
      "pronunciation_hint": "위",
      "usage_note": "긍정.",
      "tags": [
        "essential"
      ],
      "audio_text": "Oui."
    },
    {
      "id": "fr_essential_009",
      "category": "essential",
      "priority": "P0",
      "fr": "Non.",
      "ko": "아니요.",
      "pronunciation_hint": "농",
      "usage_note": "부정.",
      "tags": [
        "essential"
      ],
      "audio_text": "Non."
    },
    {
      "id": "fr_essential_010",
      "category": "essential",
      "priority": "P0",
      "fr": "D'accord.",
      "ko": "알겠습니다 / 좋아요.",
      "pronunciation_hint": "다코르",
      "usage_note": "동의·확인.",
      "tags": [
        "essential"
      ],
      "audio_text": "D'accord."
    },
    {
      "id": "fr_essential_011",
      "category": "essential",
      "priority": "P0",
      "fr": "Je ne comprends pas.",
      "ko": "이해하지 못했습니다.",
      "pronunciation_hint": "주 느 콩프랑 파",
      "usage_note": "상대의 말을 이해하지 못했을 때.",
      "tags": [
        "essential"
      ],
      "audio_text": "Je ne comprends pas."
    },
    {
      "id": "fr_essential_012",
      "category": "essential",
      "priority": "P0",
      "fr": "Je ne parle pas bien français.",
      "ko": "프랑스어를 잘 못합니다.",
      "pronunciation_hint": "주 느 파를 파 비앙 프랑세",
      "usage_note": "필요하면 바로 영어 사용 여부를 묻는다.",
      "tags": [
        "essential"
      ],
      "audio_text": "Je ne parle pas bien français."
    },
    {
      "id": "fr_essential_013",
      "category": "essential",
      "priority": "P0",
      "fr": "Parlez-vous anglais ?",
      "ko": "영어 하십니까?",
      "pronunciation_hint": "파를레 부 앙글레",
      "usage_note": "정중한 영어 가능 여부 확인.",
      "tags": [
        "essential"
      ],
      "audio_text": "Parlez-vous anglais ?"
    },
    {
      "id": "fr_essential_014",
      "category": "essential",
      "priority": "P0",
      "fr": "Plus lentement, s'il vous plaît.",
      "ko": "좀 천천히 말씀해 주세요.",
      "pronunciation_hint": "플뤼 랑트망 실 부 플레",
      "usage_note": "상대가 너무 빨리 말할 때.",
      "tags": [
        "essential"
      ],
      "audio_text": "Plus lentement, s'il vous plaît."
    },
    {
      "id": "fr_essential_015",
      "category": "essential",
      "priority": "P0",
      "fr": "Pouvez-vous répéter ?",
      "ko": "다시 말씀해 주시겠어요?",
      "pronunciation_hint": "푸베 부 레페테",
      "usage_note": "재확인.",
      "tags": [
        "essential"
      ],
      "audio_text": "Pouvez-vous répéter ?"
    },
    {
      "id": "fr_essential_016",
      "category": "essential",
      "priority": "P0",
      "fr": "Comment dit-on … en français ?",
      "ko": "…를 프랑스어로 뭐라고 하나요?",
      "pronunciation_hint": "코망 디통 … 앙 프랑세",
      "usage_note": "단어를 물을 때.",
      "tags": [
        "essential"
      ],
      "audio_text": "Comment dit-on … en français ?"
    },
    {
      "id": "fr_essential_017",
      "category": "essential",
      "priority": "P0",
      "fr": "Qu'est-ce que ça veut dire ?",
      "ko": "이게 무슨 뜻인가요?",
      "pronunciation_hint": "케스 크 사 뵈 디르",
      "usage_note": "표지·메뉴 뜻을 물을 때.",
      "tags": [
        "essential"
      ],
      "audio_text": "Qu'est-ce que ça veut dire ?"
    },
    {
      "id": "fr_essential_018",
      "category": "essential",
      "priority": "P0",
      "fr": "Où sont les toilettes ?",
      "ko": "화장실은 어디입니까?",
      "pronunciation_hint": "우 송 레 투알레트",
      "usage_note": "범용.",
      "tags": [
        "essential"
      ],
      "audio_text": "Où sont les toilettes ?"
    },
    {
      "id": "fr_essential_019",
      "category": "essential",
      "priority": "P0",
      "fr": "C'est loin ?",
      "ko": "먼가요?",
      "pronunciation_hint": "세 루앵",
      "usage_note": "거리 확인.",
      "tags": [
        "essential"
      ],
      "audio_text": "C'est loin ?"
    },
    {
      "id": "fr_essential_020",
      "category": "essential",
      "priority": "P0",
      "fr": "Merci, au revoir.",
      "ko": "감사합니다. 안녕히 계세요.",
      "pronunciation_hint": "메르시 오르부아르",
      "usage_note": "가게·식당을 나갈 때.",
      "tags": [
        "essential"
      ],
      "audio_text": "Merci, au revoir."
    },
    {
      "id": "fr_restaurant_001",
      "category": "restaurant",
      "priority": "P0",
      "fr": "Une table pour deux, s'il vous plaît.",
      "ko": "두 명 자리 부탁합니다.",
      "pronunciation_hint": "윈 타블 푸르 되 실 부 플레",
      "usage_note": "식당 입장.",
      "tags": [
        "restaurant"
      ],
      "audio_text": "Une table pour deux, s'il vous plaît."
    },
    {
      "id": "fr_restaurant_002",
      "category": "restaurant",
      "priority": "P0",
      "fr": "Nous avons une réservation.",
      "ko": "예약했습니다.",
      "pronunciation_hint": "누 자봉 윈 레제르바시옹",
      "usage_note": "예약 식당.",
      "tags": [
        "restaurant"
      ],
      "audio_text": "Nous avons une réservation."
    },
    {
      "id": "fr_restaurant_003",
      "category": "restaurant",
      "priority": "P0",
      "fr": "Au nom de Kim.",
      "ko": "Kim 이름으로 했습니다.",
      "pronunciation_hint": "오 농 드 김",
      "usage_note": "예약자 이름을 말할 때.",
      "tags": [
        "restaurant"
      ],
      "audio_text": "Au nom de Kim."
    },
    {
      "id": "fr_restaurant_004",
      "category": "restaurant",
      "priority": "P0",
      "fr": "En terrasse, si possible.",
      "ko": "가능하면 테라스로 부탁합니다.",
      "pronunciation_hint": "앙 테라스 시 포시블",
      "usage_note": "좌석 요청.",
      "tags": [
        "restaurant"
      ],
      "audio_text": "En terrasse, si possible."
    },
    {
      "id": "fr_restaurant_005",
      "category": "restaurant",
      "priority": "P0",
      "fr": "À l'intérieur, s'il vous plaît.",
      "ko": "실내로 부탁합니다.",
      "pronunciation_hint": "아 랭테리외르 실 부 플레",
      "usage_note": "좌석 요청.",
      "tags": [
        "restaurant"
      ],
      "audio_text": "À l'intérieur, s'il vous plaît."
    },
    {
      "id": "fr_restaurant_006",
      "category": "restaurant",
      "priority": "P0",
      "fr": "La carte, s'il vous plaît.",
      "ko": "메뉴 부탁합니다.",
      "pronunciation_hint": "라 카르트 실 부 플레",
      "usage_note": "메뉴 요청.",
      "tags": [
        "restaurant"
      ],
      "audio_text": "La carte, s'il vous plaît."
    },
    {
      "id": "fr_restaurant_007",
      "category": "restaurant",
      "priority": "P0",
      "fr": "Qu'est-ce que vous recommandez ?",
      "ko": "무엇을 추천하시나요?",
      "pronunciation_hint": "케스 크 부 르코망데",
      "usage_note": "추천 메뉴 문의.",
      "tags": [
        "restaurant"
      ],
      "audio_text": "Qu'est-ce que vous recommandez ?"
    },
    {
      "id": "fr_restaurant_008",
      "category": "restaurant",
      "priority": "P0",
      "fr": "Je voudrais ceci.",
      "ko": "이것을 주세요.",
      "pronunciation_hint": "주 부드레 스시",
      "usage_note": "메뉴를 가리키며 사용.",
      "tags": [
        "restaurant"
      ],
      "audio_text": "Je voudrais ceci."
    },
    {
      "id": "fr_restaurant_009",
      "category": "restaurant",
      "priority": "P0",
      "fr": "Pour moi, le poisson.",
      "ko": "저는 생선으로 하겠습니다.",
      "pronunciation_hint": "푸르 무아 르 푸아송",
      "usage_note": "주문.",
      "tags": [
        "restaurant"
      ],
      "audio_text": "Pour moi, le poisson."
    },
    {
      "id": "fr_restaurant_010",
      "category": "restaurant",
      "priority": "P0",
      "fr": "Pour moi, la viande.",
      "ko": "저는 고기로 하겠습니다.",
      "pronunciation_hint": "푸르 무아 라 비앙드",
      "usage_note": "주문.",
      "tags": [
        "restaurant"
      ],
      "audio_text": "Pour moi, la viande."
    },
    {
      "id": "fr_restaurant_011",
      "category": "restaurant",
      "priority": "P0",